<?xml version="1.0" encoding="UTF-8"?>

<inter:interesovanje xmlns:xsi="http://www.w3.org/2001/XMLSchema-instance"
    xsi:schemaLocation="http://www.ftn.uns.ac.rs/interesovanje ../schemas/interesovanje.xsd"
    xmlns:inter = "http://www.ftn.uns.ac.rs/interesovanje">
    <inter:drzavljaninSrbije/>
    <inter:jmbg>0102998152031</inter:jmbg>
    <inter:ime>Иван</inter:ime>
    <inter:prezime>Мршуља</inter:prezime>
    <inter:email>mrki@gmail.com</inter:email>
    <inter:brojMobilnog>0631234156</inter:brojMobilnog>
    <inter:brojFiksnog>011123456</inter:brojFiksnog>
    <inter:lokacijaPrimanja>Нови Сад</inter:lokacijaPrimanja>
    <inter:sinopharm/>
    <inter:nijeDavalacKrvi/>
</inter:interesovanje>
